{
  "gateVersion": 1,
  "issue": 298,
  "metrics": {
    "acceptanceMapped": 3,
    "acceptanceTotal": 3,
    "criticalFindings": 0,
    "modulesTouched": [
      "backend/src/juli_backend/workers/services/polling/orchestrate.py",
      "backend/src/juli_backend/repositories/repos.py",
      "backend/src/juli_backend/models/models.py",
      "backend/src/juli_backend/integrations/tiktok/rate_limiter.py",
      "backend/src/juli_backend/database/migrations/versions/009_tiktok_sync_state.py",
      "backend/src/juli_backend/workers/services/polling/MODULE.md",
      "tests/unit/test_fujiwa_polling_orchestration.py"
    ]
  },
  "review": {
    "artifactRef": "git-history:agent-runtime/artifacts/reviews/review-issue-298.json",
    "sha256": "913d15fad47dcc8a23d53b3ab8923044eee1d817e255b97194c0aa67e7986899",
    "status": "PASS"
  },
  "timestamp": "2026-07-11T00:36:09Z",
  "validation": {
    "artifactRef": "git-history:agent-runtime/artifacts/validation/validation-issue-298.json",
    "sha256": "30cbed0ed62040b7072cde52553585266f95039688ef8f5921362ffa6b38e03e",
    "status": "PASS"
  },
  "wave": null
}
