{
  "gateVersion": 1,
  "issue": 39,
  "metrics": {
    "acceptanceMapped": 4,
    "acceptanceTotal": 4,
    "criticalFindings": 0,
    "modulesTouched": [
      "src/recommendations",
      "src/intelligence/forecasting",
      "src/data"
    ]
  },
  "review": {
    "artifactRef": "git-history:agent-runtime/artifacts/reviews/review-issue-39.json",
    "sha256": "10dc60657ba20d7cff43acf102480e291ba37d8ee98b6094d3af4843ba95c4b0",
    "status": "PASS"
  },
  "timestamp": "2026-05-27T12:05:00Z",
  "validation": {
    "artifactRef": "git-history:agent-runtime/artifacts/validation/validation-issue-39.json",
    "sha256": "bec42effb15a1d82176605f0d12fca94f2dd1a615bcee903a9f5dab05cca58b1",
    "status": "PASS"
  },
  "wave": null
}
