{
  "gateVersion": 1,
  "issue": 1125,
  "metrics": {
    "acceptanceMapped": 12,
    "acceptanceTotal": 12,
    "criticalFindings": 0,
    "modulesTouched": [
      "backend/src/juli_backend/models/models.py",
      "backend/src/juli_backend/database/migrations/versions/035_workflow_run_events_table.py",
      "backend/src/juli_backend/services/agent/events/__init__.py",
      "backend/src/juli_backend/services/agent/events/envelope.py",
      "backend/src/juli_backend/services/agent/events/payloads.py",
      "backend/src/juli_backend/services/agent/events/sink.py",
      "docs/architecture/ownership-registry.yml",
      "tests/unit/test_workflow_run_event_envelope.py",
      "tests/unit/test_workflow_run_event_sink.py",
      "tests/unit/test_workflow_run_events_schema.py",
      "tests/unit/test_workflow_runs_schema.py"
    ]
  },
  "review": {
    "artifactRef": "git-history:agent-runtime/artifacts/reviews/review-issue-1125.json",
    "sha256": "eaaf58f549cfa1b4e42a94d28532d4597cbb87b4d4ef92f020e664a5dd56fc4b",
    "status": "PASS"
  },
  "timestamp": "2026-08-14T13:45:55Z",
  "validation": {
    "artifactRef": "git-history:agent-runtime/artifacts/validation/validation-issue-1125.json",
    "sha256": "6827996f3cc3e2076ef93942d01ece00289bb4438da74734bbdc2ff0c206bfbf",
    "status": "PASS"
  },
  "wave": "wave-agent-w3"
}
