{
  "gateVersion": 1,
  "issue": 1328,
  "metrics": {
    "acceptanceMapped": 9,
    "acceptanceTotal": 9,
    "criticalFindings": 0,
    "modulesTouched": [
      "backend/src/juli_backend/database/migrations/versions/045_rls_policies.py",
      "tests/integration/test_rls_policies.py",
      "tests/unit/test_rls_policies_migration.py"
    ]
  },
  "review": {
    "artifactRef": "git-history:agent-runtime/artifacts/reviews/review-issue-1328.json",
    "ownerSignoffPresent": true,
    "sha256": "0f2a778ff1e495c991c529dd1f8628ebf0200bf98bd906e12e16e5dc6134757b",
    "signoffRequired": false,
    "status": "PASS",
    "warningsAcknowledged": true
  },
  "timestamp": "2026-08-26T03:14:55Z",
  "validation": {
    "artifactRef": "git-history:agent-runtime/artifacts/validation/validation-issue-1328.json",
    "sha256": "e3023528b77d52a743f0bb094b82f99b6a8206f1c9ec484093c9892b46a89f96",
    "status": "PASS"
  },
  "wave": "wave-w7"
}
