{
  "gateVersion": 1,
  "issue": 1272,
  "metrics": {
    "acceptanceMapped": 4,
    "acceptanceTotal": 4,
    "criticalFindings": 0,
    "modulesTouched": [
      "backend/src/juli_backend/services/agent/runner/core.py",
      "backend/src/juli_backend/services/agent/runner/seller_facing_copy.py"
    ]
  },
  "review": {
    "artifactRef": "git-history:agent-runtime/artifacts/reviews/review-issue-1272.json",
    "ownerSignoffPresent": true,
    "sha256": "2b3bfe7b0bedb7c416842549315e1c2a670b5624a00b35c4d662ab5275ecf324",
    "signoffRequired": false,
    "status": "PASS",
    "warningsAcknowledged": true
  },
  "timestamp": "2026-08-28T08:30:16Z",
  "validation": {
    "artifactRef": "git-history:agent-runtime/artifacts/validation/validation-issue-1272.json",
    "sha256": "4a35b65062248ffac28d3acd94d358789f5d817a7ca7e473d6a0805998f07e80",
    "status": "PASS"
  },
  "wave": "wave-agent-w6"
}
