{
  "gateVersion": 1,
  "issue": 1014,
  "metrics": {
    "acceptanceMapped": 3,
    "acceptanceTotal": 3,
    "criticalFindings": 0,
    "modulesTouched": [
      "backend/src/juli_backend/services/agent/tools"
    ]
  },
  "review": {
    "artifactRef": "git-history:agent-runtime/artifacts/reviews/review-issue-1014.json",
    "sha256": "3cbb58849d554643cb26dcf98febcdcbd79cb6c10f5250676f3a78d1b2777920",
    "status": "PASS"
  },
  "timestamp": "2026-08-14T04:49:44Z",
  "validation": {
    "artifactRef": "git-history:agent-runtime/artifacts/validation/validation-issue-1014.json",
    "sha256": "63a7244a4532c11551be23bad9e1442944792fb5889e2865ad311b53be423463",
    "status": "PASS"
  },
  "wave": null
}
