{
  "gateVersion": 1,
  "issue": 629,
  "metrics": {
    "acceptanceMapped": 4,
    "acceptanceTotal": 4,
    "criticalFindings": 0,
    "modulesTouched": [
      "services/cdp_speed"
    ]
  },
  "review": {
    "artifactRef": "git-history:agent-runtime/artifacts/reviews/review-issue-629.json",
    "sha256": "21ffc41e974b558bea9de8c9bae3f030975972e9824d4babba8daa74eb207b17",
    "status": "PASS"
  },
  "timestamp": "2026-08-03T08:31:45Z",
  "validation": {
    "artifactRef": "git-history:agent-runtime/artifacts/validation/validation-issue-629.json",
    "sha256": "036c1a434738f50bea796da0d8dd1223c38613d234ccddf4c74582ed354feb1d",
    "status": "PASS"
  },
  "wave": "wave-a1-cdp-speed"
}
