{
  "gateVersion": 1,
  "issue": 1216,
  "metrics": {
    "acceptanceMapped": 5,
    "acceptanceTotal": 5,
    "criticalFindings": 1,
    "modulesTouched": [
      "backend/src/juli_backend/services/agent/runner/conversation_store.py",
      "backend/src/juli_backend/services/agent/runner/core.py",
      "tests/unit/test_agent_runner_core.py",
      "tests/unit/test_agent_runner_pause_resume.py",
      "tests/unit/test_agent_runner_terminal_persistence.py",
      "tests/unit/test_agent_runner_termination.py"
    ]
  },
  "review": {
    "artifactRef": "git-history:agent-runtime/artifacts/reviews/review-issue-1216.json",
    "ownerSignoffPresent": true,
    "sha256": "f989029917e3a6c1653df36c381927a2d896bd6153d0080f8f1831f421a0b48e",
    "signoffRequired": false,
    "status": "PASS",
    "warningsAcknowledged": true
  },
  "timestamp": "2026-08-20T06:44:46Z",
  "validation": {
    "artifactRef": "git-history:agent-runtime/artifacts/validation/validation-issue-1216.json",
    "sha256": "4b57a4f5aca22bd02415f4deddcd554361f78b141d18f244fc637e14158e5bce",
    "status": "PASS"
  },
  "wave": "wave-agent-w4"
}
